{
  "schema_version": "3.0",
  "event_type": "mixed",
  "agent": {
    "version": "3.0.0",
    "machine": "PDV-ANON-01",
    "sent_at": "2026-02-11T14:10:00-03:00"
  },
  "store": {
    "id_ponto_venda": 13,
    "nome": "Loja Anonima 13",
    "alias": "loja-13"
  },
  "window": {
    "from": "2026-02-11T14:00:00-03:00",
    "to": "2026-02-11T14:10:00-03:00",
    "minutes": 10
  },
  "turnos": [
    {
      "id_turno": "A1B2C3D4-E5F6-4701-8A90-000000000014",
      "sequencial": 2,
      "fechado": true,
      "data_hora_inicio": "2026-02-11T08:00:00-03:00",
      "data_hora_termino": "2026-02-11T14:05:00-03:00",
      "duracao_minutos": 365,
      "periodo": "MATUTINO",
      "operador": { "id_usuario": 12, "nome": "Operador 12" },
      "responsavel": null,
      "qtd_vendas": 2,
      "total_vendas": 420.0,
      "qtd_vendedores": 2,
      "totais_sistema": {
        "total": 420.0,
        "qtd_vendas": 2,
        "por_pagamento": [
          { "id_finalizador": 3, "meio": "Debito", "total": 175.0, "qtd_vendas": 1 },
          { "id_finalizador": 4, "meio": "Credito", "total": 245.0, "qtd_vendas": 1 }
        ]
      },
      "fechamento_declarado": {
        "total": 415.0,
        "qtd_vendas": 2,
        "por_pagamento": [
          { "id_finalizador": 3, "meio": "Debito", "total": 170.0, "qtd_vendas": 1 },
          { "id_finalizador": 4, "meio": "Credito", "total": 245.0, "qtd_vendas": 1 }
        ]
      },
      "falta_caixa": {
        "total": 5.0,
        "qtd_vendas": 1,
        "por_pagamento": [
          { "id_finalizador": 3, "meio": "Debito", "total": 5.0, "qtd_vendas": 1 }
        ]
      }
    }
  ],
  "vendas": [
    {
      "id_operacao": 55001,
      "canal": "HIPER_CAIXA",
      "data_hora": "2026-02-11T14:03:00-03:00",
      "id_turno": "A1B2C3D4-E5F6-4701-8A90-000000000014",
      "itens": [
        {
          "line_id": 920001,
          "line_no": 1,
          "id_produto": 6001,
          "codigo_barras": "7890000006001",
          "nome": "Produto 6001",
          "qtd": 1,
          "preco_unit": 175.0,
          "total": 175.0,
          "desconto": 0,
          "vendedor": { "id_usuario": 90, "nome": "Vendedor 90" }
        }
      ],
      "pagamentos": [
        {
          "line_id": 930001,
          "line_no": 1,
          "id_finalizador": 3,
          "meio": "Debito",
          "valor": 175.0,
          "troco": 0,
          "parcelas": 1
        }
      ],
      "total": 175.0
    },
    {
      "id_operacao": 55001,
      "canal": "HIPER_LOJA",
      "data_hora": "2026-02-11T14:04:00-03:00",
      "id_turno": null,
      "itens": [
        {
          "line_id": 920101,
          "line_no": 1,
          "id_produto": 6002,
          "codigo_barras": "7890000006002",
          "nome": "Produto 6002",
          "qtd": 1,
          "preco_unit": 245.0,
          "total": 245.0,
          "desconto": 0,
          "vendedor": { "id_usuario": 91, "nome": "Vendedor 91" }
        }
      ],
      "pagamentos": [
        {
          "line_id": 930101,
          "line_no": 1,
          "id_finalizador": 4,
          "meio": "Credito",
          "valor": 245.0,
          "troco": 0,
          "parcelas": 2
        }
      ],
      "total": 245.0
    }
  ],
  "resumo": {
    "by_vendor": [
      { "id_usuario": 90, "nome": "Vendedor 90", "qtd_cupons": 1, "total_vendido": 175.0 },
      { "id_usuario": 91, "nome": "Vendedor 91", "qtd_cupons": 1, "total_vendido": 245.0 }
    ],
    "by_payment": [
      { "id_finalizador": 3, "meio": "Debito", "total": 175.0 },
      { "id_finalizador": 4, "meio": "Credito", "total": 245.0 }
    ]
  },
  "snapshot_turnos": [
    {
      "id_turno": "A1B2C3D4-E5F6-4701-8A90-000000000014",
      "sequencial": 2,
      "fechado": true,
      "data_hora_inicio": "2026-02-11T08:00:00-03:00",
      "data_hora_termino": "2026-02-11T14:05:00-03:00",
      "duracao_minutos": 365,
      "periodo": "MATUTINO",
      "operador": { "id_usuario": 12, "nome": "Operador 12" },
      "responsavel": null,
      "qtd_vendas": 2,
      "total_vendas": 420.0,
      "qtd_vendedores": 2
    }
  ],
  "snapshot_vendas": [
    {
      "id_operacao": 55001,
      "canal": "HIPER_CAIXA",
      "data_hora_inicio": "2026-02-11T14:03:00-03:00",
      "data_hora_termino": "2026-02-11T14:03:20-03:00",
      "duracao_segundos": 20,
      "id_turno": "A1B2C3D4-E5F6-4701-8A90-000000000014",
      "turno_seq": 2,
      "vendedor": { "id_usuario": 90, "nome": "Vendedor 90" },
      "qtd_itens": 1,
      "total_itens": 175.0
    },
    {
      "id_operacao": 55001,
      "canal": "HIPER_LOJA",
      "data_hora_inicio": "2026-02-11T14:04:00-03:00",
      "data_hora_termino": "2026-02-11T14:04:25-03:00",
      "duracao_segundos": 25,
      "id_turno": null,
      "turno_seq": null,
      "vendedor": { "id_usuario": 91, "nome": "Vendedor 91" },
      "qtd_itens": 1,
      "total_itens": 245.0
    }
  ],
  "ops": {
    "count": 1,
    "ids": [55001],
    "loja_count": 1,
    "loja_ids": [55001]
  },
  "integrity": {
    "sync_id": "fixture-v3-mixed-caixa-loja-001",
    "warnings": ["responsavel_missing"]
  }
}
